{
  "$schema": "./surface-matrix.schema.json",
  "schema_version": 1,
  "knowledge_ledger": "../evidence/findings.json",
  "hosts": {
    "hermes": {
      "cli_version": "0.21.5+2456.gb7840ef",
      "source_revision": "b7840eff8ee07dd8c8ef134f577b871d1f9f7244",
      "sources": [
        "https://hermes-agent.nousresearch.com/docs/",
        "https://github.com/NousResearch/hermes-agent"
      ]
    },
    "codex": {
      "cli_version": "0.158.0-alpha.2.1",
      "source_revision": "unknown; installed binary reports 0.158.0-alpha.2.1",
      "sources": [
        "https://developers.openai.com/codex/",
        "https://github.com/openai/codex"
      ]
    },
    "omp": {
      "cli_version": "18.8.9",
      "source_revision": "Installed OMP18.8.9; native template/context and request hooks verified without model inference",
      "sources": [
        "https://github.com/can1357/oh-my-pi/releases/tag/v18.8.9"
      ]
    }
  },
  "staleness": {
    "max_age_days": 90,
    "triggers": [
      "active model or tool policy changes materially",
      "a host version or source revision changes",
      "an admitted artifact changes",
      "an upstream dependency or source version changes",
      "a regression or contradiction is observed"
    ]
  },
  "modalities": [
    {
      "id": "instructions-style",
      "contract": "Host observations bind exact user-owned instruction artifacts and native loading; provider/runtime layers remain external and project instructions retain native precedence.",
      "status": "partial",
      "portable_artifacts": [
        "surfaces/core.md",
        "contracts/instruction-surfaces.json",
        "contracts/instruction-units.json",
        "profiles/current-observed-defaults.json",
        "recovery/current/hosts/hermes/SOUL.md",
        "recovery/current/hosts/codex/AGENTS.md"
      ],
      "hosts": {
        "hermes": {
          "owner": "recovery/current/hosts/hermes/SOUL.md plus Hermes native prompt builder",
          "mechanism": "restore the hash-bound user-global SOUL overlay; keep runtime-native system assembly and project context external/native",
          "support": "adapter",
          "parity": "candidate"
        },
        "codex": {
          "owner": "recovery/current/hosts/codex/AGENTS.md plus native AGENTS hierarchy",
          "mechanism": "restore the hash-bound global AGENTS overlay while preserving project and tree-scoped overrides",
          "support": "adapter",
          "parity": "candidate"
        },
        "omp": {
          "owner": "OMP native discovery; no managed global overlay currently loads",
          "mechanism": "Codex provider is not enabled and no native OMP AGENTS.md exists; do not infer inheritance",
          "support": "native",
          "parity": "intentional-delta"
        }
      },
      "intentional_deltas": [
        "Codex keeps hierarchical repository instruction scoping.",
        "Hermes keeps personality selection and frozen per-session prompt behavior.",
        "OMP currently has no managed user-global standing overlay; no Codex inheritance is claimed.",
        "Provider-hidden and runtime-native system instructions are version-qualified external dependencies, not copied artifacts."
      ],
      "evidence": {
        "suites": [
          "evals/core-instruction-retirement.json",
          "evals/surface-convergence.json",
          "evals/surface-convergence-held-out.json"
        ],
        "summaries": [
          "evals/results/current-model-instruction-profile-deterministic.json",
          "evals/results/surface-convergence-codex.json",
          "evals/results/surface-convergence-held-out-codex.json",
          "evals/results/prompt-sentence-review.json"
        ]
      }
    },
    {
      "id": "skills-procedures",
      "contract": "Portable procedures use the Agent Skills directory format from one canonical tree; each host retains native discovery, triggering, and lifecycle UX.",
      "status": "partial",
      "portable_artifacts": [
        "skills/",
        "registry.json"
      ],
      "hosts": {
        "hermes": {
          "owner": "skills loader and skills.external_dirs",
          "mechanism": "register the canonical skills directory as an external source",
          "support": "native",
          "parity": "candidate"
        },
        "codex": {
          "owner": "$HOME/.agents/skills discovery",
          "mechanism": "link admitted skill directories individually into the standard user scope",
          "support": "native",
          "parity": "candidate"
        },
        "omp": {
          "owner": "$HOME/.omp/agent/skills discovery",
          "mechanism": "use thin discovery adapters that load the canonical portable owner when OMP does not enumerate Windows directory junctions",
          "support": "adapter",
          "parity": "candidate"
        }
      },
      "intentional_deltas": [
        "Hermes retains hub install, explicit preload, and curator lifecycle features.",
        "Codex retains its native discovery scopes and plugin-bundled skills.",
        "OMP uses a thin real-directory discovery adapter for the canonical outcome-first owner because its /skills enumeration omitted the Windows junction; direct invocation succeeded."
      ],
      "evidence": {
        "suites": [
          "evals/surface-convergence.json",
          "evals/surface-convergence-held-out.json",
          "evals/organic-architecture-governance.json"
        ],
        "summaries": [
          "evals/results/surface-convergence-codex.json",
          "evals/results/surface-convergence-held-out-codex.json",
          "evals/results/organic-architecture-governance-2026-08-25.json"
        ]
      }
    },
    {
      "id": "tools-mcp",
      "contract": "Tool intent and acceptance tests are portable; MCP is preferred for shared external tools, while high-value host-native tools remain native.",
      "status": "unassessed",
      "portable_artifacts": [],
      "hosts": {
        "hermes": {
          "owner": "toolsets, plugins, and MCP client",
          "mechanism": "map shared tools to MCP or plugins; retain service-gated core tools",
          "support": "native",
          "parity": "unassessed"
        },
        "codex": {
          "owner": "built-in tools and mcp_servers configuration",
          "mechanism": "map shared tools to MCP; retain Codex-native execution and app-server tools",
          "support": "native",
          "parity": "unassessed"
        },
        "omp": {
          "owner": "built-in tools, extensions, and MCP configuration",
          "mechanism": "map shared tools to MCP or extensions while retaining OMP-native execution and IDE tooling",
          "support": "native",
          "parity": "unassessed"
        }
      },
      "intentional_deltas": [
        "Core tool schemas and approval UX are host-owned and need not be identical."
      ],
      "evidence": {
        "suites": [],
        "summaries": []
      }
    },
    {
      "id": "routing-delegation",
      "contract": "Observable task-class reliability, p95 latency, total expected cost, and failure cost determine speed- or intelligence-constrained routes; release research is portable while provider names, model IDs, effort controls, and orchestration primitives remain host-native.",
      "status": "partial",
      "portable_artifacts": [
        "surfaces/core.md",
        "skills/openai-delegation-route-research/",
        "skills/dynamic-workflows/",
        "tools/route_adapter.py",
        "integrations/hermes/routed-delegation/",
        "adapters/hermes.json",
        "evals/suites/adaptive-routing-smoke.json",
        "docs/routing-decision-interface.md"
      ],
      "hosts": {
        "hermes": {
          "owner": "routed-delegation plugin plus native child builder/finalizer",
          "mechanism": "the live user plugin selects and pins exact per-child routes through a version-guarded native seam; routed_workflow consumes the definitive portable DAG state owner and adds trusted manifest and close-witness bindings; catalogue refresh remains manual and built-in delegate_task remains the homogeneous rollback path",
          "support": "adapter",
          "parity": "candidate"
        },
        "codex": {
          "owner": "skills/dynamic-workflows state contract plus native worker handles",
          "mechanism": "initialize one exact selector receipt per DAG node, pass model and reasoning effort directly to the native worker, verify the effective route, and close the handle before terminal state",
          "support": "adapter",
          "parity": "candidate"
        },
        "omp": {
          "owner": "skills/dynamic-workflows state contract plus exact route named agents",
          "mechanism": "initialize the same receipt, dispatch route-<route-id> agents that pin exact openai-codex model and thinkingLevel, and reject resolved-model fallback",
          "support": "adapter",
          "parity": "candidate"
        }
      },
      "intentional_deltas": [
        "Hosts may expose different subagent, fallback, and reasoning controls.",
        "Catalogue refresh is manual; no host polls releases or Artificial Analysis at runtime.",
        "A fixed weak route is never used for substantive judgment merely to force mechanism parity.",
        "Workflow retries reuse one receipt; failed tasks do not climb the reasoning-effort ladder automatically."
      ],
      "evidence": {
        "suites": [
          "evals/suites/adaptive-routing-smoke.json"
        ],
        "summaries": [
          "evals/results/openai-delegation-route-research-deterministic.json",
          "evals/results/routed-dag-cross-host-smoke-2026-08-26.json",
          "evals/results/dynamic-workflows-deterministic.json",
          "evals/results/hermes-routed-dag-adapter-2026-09-04.json"
        ]
      }
    },
    {
      "id": "memory-context",